{"expected_behavior":"Project-manifest traceability analysis must pass every layer TSG through the same source enrichment used by single-file analysis, preserving source-only acceptance, forbidden, control, and scenario-only requirement nodes and edges across files.","fix_patch":"diff --git a/rust/fslc/src/main.rs b/rust/fslc/src/main.rs\n--- a/rust/fslc/src/main.rs\n+++ b/rust/fslc/src/main.rs\n@@ -12457,7 +12457,7 @@ fn project_traceability_output(path: &Path) -> Result<Value, SpecLoadError> {\n         // [benchmark issue metadata redacted]\n         // [benchmark issue metadata redacted]\n         // [benchmark issue metadata redacted]\n-        let tsg = fsl_tools::build_tsg(&model);\n+        let tsg = enrich_tsg_from_source(fsl_tools::build_tsg(&model), &model, &layer_path);\n         let display = analysis_display_path(&layer_path);\n         let file_id = format!(\"file:{layer}:{display}\");\n         let mut file_node = project_analysis_node(&file_id, \"file\", &display);\n","outcome":"proposal","proposal_id":"proposal:calibration-14","schema":"reviewgraphen.benchmark.test_fix_proposal.v1","spec_queries":["project traceability source-only acceptance forbidden controls","enrich_tsg_from_source project_traceability_output","requirements trace contract project manifest"],"test_patch":"diff --git a/rust/fslc/tests/reviewgraphen_generated_calibration_14.rs b/rust/fslc/tests/reviewgraphen_generated_calibration_14.rs\nnew file mode 100644\n--- /dev/null\n+++ b/rust/fslc/tests/reviewgraphen_generated_calibration_14.rs\n@@ -0,0 +1,18 @@\n+// SPDX-License-Identifier: Apache-2.0\n+\n+#[test]\n+fn reviewgraphen_generated_regression() {\n+    let source = include_str!(\"../src/main.rs\");\n+    let start = source\n+        .find(\"fn project_traceability_output(\")\n+        .expect(\"project traceability implementation\");\n+    let end = source[start..]\n+        .find(\"\\nfn analysis_acceptance_predicates(\")\n+        .map(|offset| start + offset)\n+        .expect(\"end of project traceability implementation\");\n+    let implementation = &source[start..end];\n+\n+    assert!(\n+        implementation.contains(\"enrich_tsg_from_source(\"),\n+        \"project layers must retain source-only traceability contracts\"\n+    );\n+}\n","test_target_id":"test-target-01","unverifiable_reason":""}